{
  "schemaVersion": "recognition-video-tail-spec/v1",
  "characterId": "yi-v5-cinematic-fixed",
  "targetCharacter": "一",
  "anchorsRef": {
    "path": "../anchors/mizige-anchors.json",
    "schemaVersion": "recognition-video-mizige-anchors/v1"
  },
  "glyph": {
    "source": "html-kaiti",
    "boxOverride": { "allowed": false }
  },
  "strokeOrder": [
    {
      "index": 1,
      "directionCode": "h",
      "phaseStartSeconds": 0.6,
      "phaseEndSeconds": 1.5,
      "notes": "Single horizontal stroke for 一."
    }
  ],
  "container": {
    "policy": "single-mizige-dual-state",
    "recognitionOpacity": 0.18,
    "writingOpacity": 0.30
  },
  "narrationPolicy": "silent",
  "transition": {
    "fromCinematicBody": "cross-dissolve",
    "durationSeconds": 0.6,
    "clearLayerIds": [
      "ink-glyph-bleed-layer",
      "light-band-layer",
      "phrase-bridge-layer"
    ]
  },
  "finalFrame": {
    "posterReady": true,
    "handPosePresent": true,
    "pointerForm": "child-hand",
    "mizigeStateAtEnd": "writing"
  },
  "outputs": {
    "composition": "output/yi-v5-cinematic-fixed.tail.html",
    "finalFramePng": "output/yi-v5-cinematic-fixed.tail.final-frame.png",
    "domProbeJson": "output/yi-v5-cinematic-fixed.tail.dom-probe.json"
  }
}
